{
  "generated_at": "2026-10-13T10:15:58.737Z",
  "curated_at": "2026-10-13",
  "method": "Hand-curated for the Streamer Desk (wave 29 / rotation 12) from ordinary web search on 2026-10-13. Directory facts carry at least one credible source each; drama-timeline entries carry two or more independent sources per event or are not printed as verified. Rosters are dated claims ('as of'), never eternal facts. No viewership or follower numbers are printed unless a source states them for a dated event.",
  "sourcing_standard": {
    "directory": "1+ credible source per profile/house, named on the record.",
    "drama": "Timeline format only. An event is 'verified' only when 2+ independent credible sources report it. Single-source or disputed claims are listed under 'unverified' with the allegation labeled as an allegation, or omitted. Neutral tone; no rumor is printed as fact.",
    "updates": "1+ credible source per dated entry; records and platform moves prefer 2."
  },
  "honesty": "Every profile and house carries its sources on the record. A drama event is printed as verified only when two or more independent sources report it; anything weaker is listed under unverified with the reason, or omitted. Rosters are dated 'as of' claims. No follower, viewership or revenue numbers appear except where a named source states them for a dated event. Event status is computed from dates at build time — a past event never poses as upcoming.",
  "provenance": {
    "seed": "data/streamer_desk.json (hand-curated, wave 29)",
    "generator": "scripts/build_streamer_desk.js (refuses to publish a seed that breaks the sourcing standard)",
    "live_lane": "pipeline/out/streamers.json via pipeline/fetch_streamers.py (the Desk's Live Wire lane — real recorded hits only)"
  },
  "counts": {
    "streamers": 18,
    "houses": 5,
    "updates": 6,
    "drama_verified": 4,
    "unverified": 2,
    "drama_source_domains": 8,
    "events": 7,
    "events_upcoming": 2,
    "events_past": 5,
    "feeds_skip_by_design": 3
  },
  "streamers": [
    {
      "as_of": "2026-10-13",
      "categories": [
        "Just Chatting",
        "variety",
        "IRL",
        "subathons"
      ],
      "crew": "amp",
      "id": "kai-cenat",
      "name": "Kai Cenat",
      "note": "AMP member since 2020; host of the Mafiathon subathon series.",
      "platforms": [
        "Twitch",
        "YouTube"
      ],
      "sources": [
        {
          "name": "Wikipedia — AMP (streamer collective)",
          "url": "https://en.wikipedia.org/wiki/AMP_(streamer_collective)"
        },
        {
          "name": "Black Enterprise — Mafiathon 3 record",
          "url": "https://www.blackenterprise.com/kai-cenat-breaks-streaming-record-update-nigerian-school/"
        }
      ]
    },
    {
      "as_of": "2026-10-13",
      "categories": [
        "Just Chatting",
        "variety",
        "roleplay"
      ],
      "crew": "amp",
      "id": "fanum",
      "name": "Fanum",
      "note": "AMP member since 2019; won Best Roleplay Streamer at the 2025 Streamer Awards.",
      "platforms": [
        "Twitch",
        "YouTube"
      ],
      "sources": [
        {
          "name": "Wikipedia — AMP (streamer collective)",
          "url": "https://en.wikipedia.org/wiki/AMP_(streamer_collective)"
        },
        {
          "name": "esports.gg — Streamer Awards 2025 winners",
          "url": "https://esports.gg/news/streamers/streamer-awards-2025/"
        }
      ]
    },
    {
      "as_of": "2026-10-13",
      "categories": [
        "Just Chatting",
        "gaming",
        "variety"
      ],
      "crew": "amp",
      "id": "agent00",
      "name": "Agent 00",
      "note": "AMP member since 2019; won Best Stream Duo (with ExtraEmily) at the 2025 Streamer Awards.",
      "platforms": [
        "Twitch",
        "YouTube"
      ],
      "sources": [
        {
          "name": "Wikipedia — AMP (streamer collective)",
          "url": "https://en.wikipedia.org/wiki/AMP_(streamer_collective)"
        },
        {
          "name": "esports.gg — Streamer Awards 2025 winners",
          "url": "https://esports.gg/news/streamers/streamer-awards-2025/"
        }
      ]
    },
    {
      "as_of": "2026-10-13",
      "categories": [
        "NBA 2K",
        "gaming",
        "IRL"
      ],
      "crew": "amp",
      "id": "duke-dennis",
      "name": "Duke Dennis",
      "note": "AMP member since 2019; rose through NBA 2K content.",
      "platforms": [
        "Twitch",
        "YouTube"
      ],
      "sources": [
        {
          "name": "Wikipedia — AMP (streamer collective)",
          "url": "https://en.wikipedia.org/wiki/AMP_(streamer_collective)"
        }
      ]
    },
    {
      "as_of": "2026-10-13",
      "categories": [
        "IRL",
        "variety",
        "gaming"
      ],
      "crew": null,
      "id": "ishowspeed",
      "name": "IShowSpeed",
      "note": "Named Streamer of the Year and Best IRL Streamer at the 2025 Streamer Awards (Dec 6, 2025).",
      "platforms": [
        "YouTube",
        "Twitch"
      ],
      "sources": [
        {
          "name": "Wikipedia — 2025 Streamer Awards",
          "url": "https://en.wikipedia.org/wiki/2025_Streamer_Awards"
        },
        {
          "name": "Streams Charts — Streamer Awards 2025",
          "url": "https://streamscharts.com/news/streamer-awards-2025-winners"
        }
      ]
    },
    {
      "as_of": "2026-10-13",
      "categories": [
        "variety",
        "reaction",
        "gaming"
      ],
      "crew": null,
      "id": "xqc",
      "name": "xQc",
      "note": "Former Overwatch pro; signed a widely reported two-year, non-exclusive Kick deal in June 2023 while continuing on Twitch.",
      "platforms": [
        "Kick",
        "Twitch",
        "YouTube"
      ],
      "sources": [
        {
          "name": "Shacknews — xQc Kick deal",
          "url": "https://www.shacknews.com/article/135983/xqc-kick-streaming-deal"
        },
        {
          "name": "Dot Esports — most lucrative streamer deals",
          "url": "https://dotesports.com/streaming/news/most-lucrative-streamer-deals-biggest-streaming-contracts"
        }
      ]
    },
    {
      "as_of": "2026-10-13",
      "categories": [
        "variety",
        "horror games",
        "gaming"
      ],
      "crew": null,
      "id": "caseoh",
      "name": "CaseOh",
      "note": "Named Gamer of the Year and Best Variety Streamer at the 2025 Streamer Awards.",
      "platforms": [
        "Twitch",
        "YouTube"
      ],
      "sources": [
        {
          "name": "Wikipedia — 2025 Streamer Awards",
          "url": "https://en.wikipedia.org/wiki/2025_Streamer_Awards"
        },
        {
          "name": "esports.gg — Streamer Awards 2025 winners",
          "url": "https://esports.gg/news/streamers/streamer-awards-2025/"
        }
      ]
    },
    {
      "as_of": "2026-10-13",
      "categories": [
        "Rainbow Six Siege",
        "strategy",
        "gaming"
      ],
      "crew": null,
      "id": "jynxzi",
      "name": "Jynxzi",
      "note": "Named Best Strategy Game Streamer at the 2025 Streamer Awards.",
      "platforms": [
        "Twitch",
        "YouTube"
      ],
      "sources": [
        {
          "name": "esports.gg — Streamer Awards 2025 winners",
          "url": "https://esports.gg/news/streamers/streamer-awards-2025/"
        }
      ]
    },
    {
      "as_of": "2026-10-13",
      "categories": [
        "FPS",
        "VTuber",
        "gaming"
      ],
      "crew": null,
      "id": "theburntpeanut",
      "name": "TheBurntPeanut",
      "note": "Named Best FPS Streamer and Best VTuber at the 2025 Streamer Awards.",
      "platforms": [
        "Twitch",
        "YouTube"
      ],
      "sources": [
        {
          "name": "esports.gg — Streamer Awards 2025 winners",
          "url": "https://esports.gg/news/streamers/streamer-awards-2025/"
        }
      ]
    },
    {
      "as_of": "2026-10-13",
      "categories": [
        "VTuber",
        "variety",
        "charity subathons"
      ],
      "crew": null,
      "id": "ironmouse",
      "name": "Ironmouse",
      "note": "Independent since leaving VShojo on July 21, 2025 (see the Drama Tracker timeline). Held Twitch's all-time subscription record from Sept 30, 2024 until Nov 2024.",
      "platforms": [
        "Twitch",
        "YouTube"
      ],
      "sources": [
        {
          "name": "Wikipedia — Ironmouse",
          "url": "https://en.wikipedia.org/wiki/Ironmouse"
        },
        {
          "name": "Wikipedia — VShojo",
          "url": "https://en.wikipedia.org/wiki/VShojo"
        }
      ]
    },
    {
      "as_of": "2026-10-13",
      "categories": [
        "MMORPG",
        "reaction",
        "commentary"
      ],
      "crew": "otk",
      "id": "asmongold",
      "name": "Asmongold",
      "note": "OTK co-founder (2020). Stepped back from OTK/Starforge leadership roles in 2024–2025 (see the Drama Tracker timeline); listed by Wikipedia as a current OTK owner and a former OTK content creator.",
      "platforms": [
        "Twitch",
        "YouTube"
      ],
      "sources": [
        {
          "name": "Wikipedia — One True King",
          "url": "https://en.wikipedia.org/wiki/One_True_King"
        },
        {
          "name": "Wikipedia — Asmongold",
          "url": "https://en.wikipedia.org/wiki/Asmongold"
        }
      ]
    },
    {
      "as_of": "2026-10-13",
      "categories": [
        "Just Chatting",
        "variety",
        "IRL"
      ],
      "crew": null,
      "id": "mizkif",
      "name": "Mizkif",
      "note": "OTK co-founder (2020); Wikipedia lists him as a former OTK owner (2020–2025) and former content creator (2020–2024). Now independent of OTK.",
      "platforms": [
        "Twitch",
        "YouTube"
      ],
      "sources": [
        {
          "name": "Wikipedia — One True King",